Job Position,Job Description,Date Created
Account Executive VCBL,"1–3 years of experience as an Account Executive, preferably from Online Media/know basic programmatic
Experience in seek new prospective clients
Have good networking track with direct client/advertising agency is a plus
Have great communication, interpersonal & presentation skills
Understand the newest advertising industry, digital programmatic ads & digital media trends
Candidates with knowledge or experience in programmatic ads and programmatic sales are preferred.",2025-11-14 02:11:51
Sales Group Head (VCBL),"Bachelor’s degree in Business, Marketing, or a related field.
Minimum 4–5 years of experience in sales, with at least 2 year in a supervisory role.
Strong leadership, communication, and negotiation skills.
Target-oriented and able to work under pressure.
Proficiency in digital workspace platform.
Good understanding of sales strategies, market trends, and customer relationship management.
Preferably from media industry, jika dia dari agency itu masih kurang karena pengalamannya berbeda dengan yang industri media",2025-11-19 03:24:04
Account Executive KOMPAS.com,"Job Description
Making long term relationship with client
Seeking & approaching new clients
Identifying and deciding client needs
Planning and doing strategic digital sales implementation based on brief from client
Always update about the growth of digital media technology
Closing sales to achieve revenue target
Minimum Qualifications
Minimum Bachelor Degree from any major
At least 2 years experience as sales executive from digital media and/or media online is a plus
Canvassing new clients
Proficient in English
Able to make and execute a sales marketing program
Excellent communication, negotiation, and presentation skill
Have good networking skill
Able to work under sales target",2025-11-17 06:42:33
Account Executive Pasangiklan.com,"Job Description
Canvasing for SME clients & maintain existing clients
Making strategy to achieve revenue target
Doing coordination for client's ad & events
Reporting for client's campaign
Weekly reporting for sales pipeline & target
Minimum Qualifications
Bachelor's degree from any discipline
Minimum 1 year experience as sales/Account Executive
Networking and negotiation skills
Able to make and execute a sales/marketing program
Having the capability to build good networking
Ability to multitask and work efficiently and effectively to meet required deadlines",2025-11-17 06:43:29
